"40","On a promotional exam a woman scored 143 on a scale of 0-160. Her score converted to a scale of 0-100 is approximately :","89","70","91","84","89"
"41","If Janet can build 22 tables in 14 days, and Anne can build 22 tables in 16 days,
approximately how long will it take them to build 22 tables together?
","9.5 days ","7.5 days ","15 days","8 days","7.5 days "
"42","How many square tiles, each 12 inches on a side, will Ozzie need to cover a floor that is 11 feet wide and 18 feet long?","99","150","163","198","198"
"43","A tax analyst earns four times as much in April as in each of the other months. What part of her entire year's earnings does she earn in April?","4/11 	","1/3 ","4/15","4/13","4/15"
"44","A train travels 70 miles when a bus travels 50 miles. How many miles will the train travel when the bus travels 60 miles?
","40","78","90","84","84"
"45","How many square tiles, each 300 nun on a side, will Jane need to cover a hall floor that is 120 cm wide and 3 .6 m long?","480","520","490","48","48"
"46","A car travels 80 km/hr and a plane travels 16 000 m/min. How far will the car travel when the plane travels 800 km?
","80.6 km ","66.7 km","60.0 km ","63 .5 km","66.7 km"
"47","A pharmacist combines ingredients x, y, and z in a ratio of 2:3 :5 to produce cough medicine How many milliliters of the second ingredient, ingredient y, is needed to make a one liter bottle of the medicine?
","0.3 ","150","300","500","300"
"48","A cabinet maker has a dowel of wood 13 mm in diameter and 0.800 m long. She needs length for the back of the chair and the remaining piece for 37 mm pegs. Pegs
greater than 13 turn in diameter or shorter than 37 mm will not work. How many good pegs can she make?
","108","11","10","109","10"
"49","2 8 18 32 50 ?","60","64","72","70","72"
"50","2304 576 144 36 9 ?","3","9","2 1/4 ","4","2 1/4 "
"51","1 3 6 10 15 ?","20","21","25","30","21"
"52","0 3 7 12 18 ?","24","29","25","34","25"
"53","16:3 24:5 44:10 36:3","5:12 ","11:4 ","14:2","12:1 ","12:1 "
"54","100:11 8:88 27:3 128:16","8:1 ","10:1 ","22:1 	","32:2 ","8:1 "
"55","51:6 126:18 38:3 28:4","14.1 ","24:8 ","15:3 	","17:2 ","17:2 "
"56","512:128 444:333 99:297 153:68","12:20 	","63:21 ","8:13 	","17:11 ","63:21"
"57","The ratio between the three angles of a quadrilateral is 13 : 9 : 5 respectively. The value of the fourth angle of the quadrilateral is 36 degree. What is the difference between the largest and the second smallest angles of the quadrilateral?","104 degree","108 degree","72 degree","96 degree","96 degree"
"58","Kamya purchased an item of Rs. 46,000 and sold it at loss of 12 per cent. With that amount she purchased another item and sold it at a gain of 12 per cent. What was her overall gain/loss? ","Loss of Rs. 662.40 ","Profit of Rs. 662.40 ","Loss of Rs. 642.80 ","Profit Rs. 642.80 	","Loss of Rs. 662.40 "
"59","The sum of six consecutive even numbers of set-A is 402. What is the sum of another set-B of four consecutive numbers whose lowest number is 15 less than double the lowest number of set- A?","444","442","440","446","442"
"60","280 metre long train moving with an average speed of 108 km/hr crosses a platform in 12 seconds. A man crosses the same platform in 10 seconds. What is the speed of the man in meter / second? ","5 m/s ","8 m/s ","12 m/s","Cannot be determined","8 m/s "
"61","Statement: There is big boom in drug business and a number of jhuggi-jhopari
dwellers in Delhi can be seen pedalling with small pouches of smack and brown sugar.

Assumptions:
I.Drug addiction is increasing in the country, specially in the capital.

II.All the big dons involved in the smuggling of drugs live in jhuggi-jhopari areas.

III.Most of the jhuggi-jhopari dwellers would do anything for money.
","Only I is implicit","Only II is implicit","Only III is implicit","Only I and III are implicit","Only I and III are implicit"
"62","Statement: ""Join X-tuition classes for sure success. Excellent teaching by excellent teachers is our strength."" - An advertisement.

Assumptions:
I.	Sure success is desirable.
II.	Students expect sure success when they join any tuition class.
III.	Just having excellent teachers does not ensure success.
","Only I and II are implicit","Only II and III are implicit","Only I and III are implicit","Only II is implicit","Only I and II are implicit"
"63","Statement: Bill Clinton is the second democrat to be re-elected as President of America, the other being the legendary Roosevelt.

Assumptions:
I.	Clinton has the same qualities that Roosevelt had.
II.	The majority of people in America have faith in Clinton.
III.	The election campaign of Clinton's rivals was not impressive.
","Only I is implicit","Only II is implicit","Only III is implicit","Either I or III is implicit","Only II is implicit"
"64","Statement: The Central Government has directed the State Governments to reduce government expenditure in view of the serious resource crunch and it may not be able to sanction any additional grant to the states for the next six months.

Assumptions:
I.The State Governments are totally dependent on Central Government for its expenditures.

II.The Central Government has reviewed the expenditure account of the State Government.

III.The State Governments will abide by the directive.
","None is implicit","Only II and III are implicit","Only III is implicit","All are implicit","Only II and III are implicit"
"65","Statement: ""To make the company commercially viable, there is an urgent need to prune the staff strength and borrow money from the financial institutions."" - Opinion of a consultant.

Assumptions:
I.	The financial institutions lend money for such proposals.
II.	The product of the company has a potential market.
III.	The employees of the company are inefficient.
","None is implicit","All are implicit","Only I and II are implicit","Only II and III are implicit","Only I and II are implicit"
"66","Statements:

I.There is increase in water level of all the water tanks supplying drinking water to the city during the last fortnight.

II.Most of the trains were cancelled last week due to water-logging on the tracks.
","Statement I is the cause and statement II is its e","Statement II is the cause and statement I is its e","Both the statements I and II are independent cause","Both the statements I and II are effects of some i","Both the statements I and II are effects of some i"
"67","Look at this series: 2, 6, 18, 54, ... What number should come next?","108","148","162","216","162"
"68","The length of a rectangle is three-fifths of the side of a square. The radius of a circle is equal to side of the square. The circumference of the circle is 132 cm. What is the area of the rectangle if the breadth of the rectangle is 8 cm? ","112.4 sq cm ","104.2 sq cm ","100.8 sq cm ","None of these","100.8 sq cm "
"69","Five-ninths of a number is equal to twenty five percent of the second number. The second number is equal to one-fourth of the third number. The value of the third number is 2960. What is 30 per cent of the first number? ","88.8","99.9","66.6","None of these ","99.9"
"70","The ratio of the present age of Manoj to that of Wasim is 3 : 11. Wasim is 12 years younger than Rehana. Rehana's age after 7 years will be 85 years. What is the present age of Manoj's father, who is 25 years older than Manoj?","43 years ","67 years ","45 years ","69 years ","43 years "
"71","Dinesh's monthly income is four times Suresh's monthly income. Suresh's monthly income is twenty per cent more than Jyoti's monthly income. Jyoti's monthly income is Rs. 22,000. What is Dinesh's monthly income? ","Rs. 1, 06, 500 ","Rs. 1, 05, 600","Rs. 1, 04, 500	","Rs. 1, 05, 400 ","Rs. 1, 05, 600"
"72","The smallest side of a right-angled triangle is 8 cm less than the side of a square of perimeter 56 cm, The second largest side of the right-angled triangle is 4 cm less than the length of the rectangle of area 96 sq cm and breadth 8 cm. What is the largest side of the right-angled triangle? ","20 cm ","12cm","10 cm ","15 cm ","10 cm "
"73","The ratio of the adjacent angles of a parallelogram is 7 : 8. Also, the ratio of the angles of quadrilateral is 5 : 6 : 7 : 12. What is the sum of the smaller angle of the parallelogram and the second largest angle of the quadrilateral? ","168","228","156","224","168"
"74","Raju runs 1250 metre on Monday and Friday. Another days he runs 1500 metre except for Sunday (He does not run on Sunday). How many kilometre will he run in 3 weeks (first day starting from Monday)? ","12.5 km ","20.5 km ","8.5 km ","25.5 km ","25.5 km "
"75","The sum of nine consecutive odd numbers of Set A is 621. What is the sum of a different set of six consecutive even numbers whose lowest number is 15 more than the lowest number of Set A?","498","468","478","None of these ","None of these "
"76","In the first 10 overs of a cricket game, the run rate was only 3.2. What should be the run rate in the remaining 40 overs to reach the target of 282 runs?","6.25
","6.5
","6.75","7","6.25"
"77","The average of 20 numbers is zero. Of them, at the most, how many may be greater than zero?","0","1","10","19","19"
"78","From a group of 7 men and 6 women, five persons are to be selected to form a committee so that at least 3 men are there on the committee. In how many ways can it be done?","564","645","735","756","756"
"79","In how many different ways can the letters of the word 'LEADING' be arranged in such a way that the vowels always come together?","360","480","720","None of these","720"
"80","Out of 7 consonants and 4 vowels, how many words of 3 consonants and 2 vowels can be formed?","210","1050","25200","21400","25200"
"81","	
Find the greatest number that will divide 43, 91 and 183 so as to leave the same remainder in each case.","4","7","9","13","4"
"82","Six bells commence tolling together and toll at intervals of 2, 4, 6, 8 10 and 12 seconds respectively. In 30 minutes, how many times do they toll together ?","4","10","15","16","16"
"83","Let N be the greatest number that will divide 1305, 4665 and 6905, leaving the same remainder in each case. Then sum of the digits in N is:","4","5","6","8","4"
"84","Three number are in the ratio of 3 : 4 : 5 and their L.C.M. is 2400. Their H.C.F. is:","40","80","120","200","40"
"85","3 pumps, working 8 hours a day, can empty a tank in 2 days. How many hours a day must 4 pumps work to empty the tank in 1 day?","9","10","11","12","12"
"86","Running at the same constant rate, 6 identical machines can produce a total of 270 bottles per minute. At this rate, how many bottles could 10 such machines produce in 4 minutes?","648","1800","2700","10800","2700"
"87","39 persons can repair a road in 12 days, working 5 hours a day. In how many days will 30 persons, working 6 hours a day, complete the work?","10","13","14","15","13"
"88","Tea worth Rs. 126 per kg and Rs. 135 per kg are mixed with a third variety in the ratio 1 : 1 : 2. If the mixture is worth Rs. 153 per kg, the price of the third variety per kg will be:","169.50","170","175.50","180","175.50"
"89","In what ratio must a grocer mix two varieties of pulses costing Rs. 15 and Rs. 20 per kg respectively so as to get a mixture worth Rs. 16.50 kg?","3:7","5:7","7:3","7:5","7:3"
"90","In what ratio must water be mixed with milk to gain 16% on selling the mixture at cost price?","1:6","6:1","2:3","4:3","1:6"
"91","	
In a 100 m race, A can give B 10 m and C 28 m. In the same race B can give C:","18 m
","20 m","27 m","9 m","20 m"
"92","The total of the ages of Amar, Akbar and Anthony is 80 years. What was the total of their ages three years ago ?","71 years","72 years","74 years","77 years","71 years"
"93","Cisco's Unified Wireless Solution provides a mesh solution. What devices do you absolutely need to purchase to run a Cisco solution?

1  WCS
2  Controller
3  Access point
4  Bridge","1 and 2","3 and 2","1 and 4","4 only","3 and 2"
"94","What is the maximum distance running the lowest data rate for 802.11g?","About 100 feet","About 175 feet","About 300 feet","About 350 feet","About 300 feet"
"95","The output of an AND gate with three inputs, A, B, and C, is HIGH when ________.","A = 1, B = 1, C = 0","A = 0, B = 0, C = 0","A = 1, B = 1, C = 1","A = 1, B = 0, C = 1","A=1, B=1, C=1"
"96","If a 3-input NOR gate has eight input possibilities, how many of those possibilities will result in a HIGH output?","1","2","7","8","1"
"97","If a signal passing through a gate is inhibited by sending a LOW into one of the inputs, and the output is HIGH, the gate is a(n):","AND","NAND","NOR","OR","NAND"
"98","Which of the following logical operations is represented by the + sign in Boolean algebra?","inversion","AND","OR","complementation","OR"
"99","When 1100010 is divided by 0101, what will be the decimal remainder?","2","3","4","6","3"
"100","Convert the decimal number 151.75 to binary.","10000111.11","11010011.01","00111100.00","10010111.11","10010111.11"
"101","The number of bits used to store a BCD digit is:","8","4","1","2","4"
"102","What is the result when a decimal 5238 is converted to base 16?","327.375","12166","1388","1476","1476"
"103","In each series, look for the degree and direction of change between the numbers. In other words, do the numbers increase or decrease, and by how much","(1/3)	","(1/8)","(2/8)	","(1/16)","(1/8)"
"104","Look at this series: 7, 10, 8, 11, 9, 12, ... What number should come next?
","7","10","12","13","10"
"105","A coffee shop blends 2 kinds of coffee,putting in 2 parts of a 33p. a gm. grade to 1 part of a 24p. a gm.If the mixture is changed to 1 part of the 

33p. a gm. to 2 parts of the less expensive grade,how much will the shop save in blending 100 gms.","Rs.8.00","Rs.3.00","Rs.1.00","Rs.0.90","Rs.3.00"
"106","Pipes P and Q can fill a tank in 12 minutes and 16 minutes respectively. Both are kept open for x minutes and then Q is closed and P fills the rest of the tank in 5 minutes. The value of  x is.","6","4","2","3","4"
"107","The average of nine consecutive odd numbers is 53. What is the smallest number ?","23","37","41","45","45"
"108","A certain type of mixture is prepared by mixing brand A at Rs.9 a kg. with brand B at Rs.4 a kg. If the mixture is worth Rs.7 a kg., how many kgs. of brand A are needed to make 40kgs. of the mixture?","Brand A needed is 20kgs.","Brand A needed is 24kgs.","Brand A needed is 28kgs.","Brand A needed is 32kgs.","Brand A needed is 24kgs."
"109","Daal is now being sold at Rs. 20 a kg. During last month its rate was Rs. 16 per kg. By how much percent should a family reduce its consumption so as to keep the expenditure fixed?","25 %","20 %","30 %","40 %","20 %."
"110","A canteen requires 45 kg rice for 3 days. How much kg of rice will it require for the months of June , July and August ?","1380 kg","1365 kg","1395 kg","1410 kg","1380 kg"
"111","Thirty men take 20 days to complete a job working 9 hours a day.How many hour a day should 40 men work to complete the job?","8 hrs","7 1/2 hrs","7 hrs","9 hrs","7 1/2 hrs"
"112","One day, Ravi left home and cycled 10 km southwards, turned right and cycled 5 km and turned right and cycled 10 km and turned left and cycled 10 km. How
many kilometers will he have to cycle to reach his home straight ?","10 km","15 km","20 km","25 km","15 km"
"113","With a 4/5 full tank a vehicle can travel 12 miles, how far can it travel with a 1/3 full tank","3 miles","5 miles","7 miles","2 miles","5 miles"
"114","A boat travels 20 kms upstream in 6 hrs and 18 kms downstream in 4 hrs.Find the speed of the boat in still water and the speed of the water current?","1/2 kmph","7/12 kmph","5 kmph","none of these","7/12 kmph"
"115","A monkey starts climbing up a tree 20ft. tall. Each hour, it hops 3ft. and slips back 2ft. How much time would it take the monkey to reach the top?","20 hours.","19 hours.","18 hours.","17 hours.","18 hours."
"116","If x=y=2z and xyz=256 then what is the value of x?","12","8","16","6","8"
"117","A man ate 100 bananas in five days, each day eating 6 more than the previous day. How many bananas did he eat on the first day?","6","8","12","14","8"
"118","I drove 60 km at 30 kmph and then an additional 60 km at 50 kmph. Compute my average speed over my 120 km.","40","37 1/2","25 1/2","50","37 1/2"
"119","The average ages of three persons is 27 years. Their ages are in the proportion of 1:3:5.What is the age in years of the youngest one among them.","45 years","27 years","9 years","3 years","9 years"
"120","What is the greatest possible length that can be used to measure exactly the following Lengths 7m, 3m 85cm, 12m 95cm ?","25 cm","35 cm","45 cm","55 cm","35 cm"
"121","Sum of three even consecutive numbers is 48, and then least number is.","20","18","16","14","14"
"122","The minute hand of a clock overtakes the hour hand at intervals of 64 minutes of correct time. How much a day does the clock gain or lose?","30 8/11 minutes.","32 6/11 minutes.","32 8/11 minutes.","30 6/11 minutes.","32 8/11 minutes."
"123","One dog tells the other that there are two dogs in front of me. The other one also shouts that he too had two behind him. How many are they?","6","5","4","3","3"
"124","Find the nth number in the series is -1, -3, -5, -7","n","(n)*(n-1)","(-1)*(2n-1)","infinite","(-1)*(2n-1)"
"125","The square of a two digit number is divided by half the number. After 36 is added to the quotient, this sum is then divided by 2. The digits of the resulting number are the same as those in the original number, but they are in reverse order. The ten's place of the original number is equal to twice the difference between its digits. What is the number?","46","48","36","38","46"
"126","In the given figure, PA and PB are tangents to the circle at A and B respectively and the chord BC is parallel to tangent PA. If AC = 6 cm, and length of the tangent AP is 9 cm, then what is the length of the chord BC?
Ans. ","BC = 2 cm.","BC = 8 cm.","BC = 6 cm.","BC = 4 cm.","BC = 4 cm."
"127","Three cards are drawn at random from an ordinary pack of cards. Find the probability that they will consist of a king, a queen and an ace.","64/1210.","32/2210.","16/2210.","64/2210.","64/2210."
"128","A number of cats got together and decided to kill between them 999919 mice. Every cat killed an equal number of mice. Each cat killed more mice than there were cats. How many cats do you think there were ?","901.","801.","891.","991.","991."
"129","If Log2 x - 5 Log x + 6 = 0, then what would the value / values of x be?","x = e5 or e3.","x = e2 or e5.","x = e2 or e3.","x = e3 or e5.","x = e2 or e3."
"130","If r = 5 z then 15 z = 3 y, then r =","y","2 y","5 y","10 y","y"
"131","A monkey starts climbing up a tree 20ft. tall. Each hour, it hops 3ft. and slips back 2ft. How much time would it take the monkey to reach the top?","20 hours.","19 hours.","18 hours.","17 hours.","18 hours."
"132","A certain type of mixture is prepared by mixing brand A at Rs.9 a kg. with brand B at Rs.4 a kg. If the mixture is worth Rs.7 a kg., how many kgs. of brand A are needed to make 40kgs. of the mixture?","Brand A needed is 20kgs.","Brand A needed is 24kgs.","Brand A needed is 28kgs.","Brand A needed is 32kgs.","Brand A needed is 24kgs."
"133","A wizard named Nepo says ""I am only three times my son's age. My father is 40 years more than twice my age. Together the three of us are a mere 1240 years old."" How old is Nepo?","360 years old.","240 years old.","320 years old.","160 years old.","360 years old."
"134","What is 35% of a number if 12 is 15% of a number?","5","12","28","33","28"
"135","A man ate 100 bananas in five days, each day eating 6 more than the previous day. How many bananas did he eat on the first day?","6","8","12","14","8"
"136","The minute hand of a clock overtakes the hour hand at intervals of 64 minutes of correct time. How much a day does the clock gain or lose?","30 8/11 minutes.","32 6/11 minutes.","32 8/11 minutes.","30 6/11 minutes.","32 8/11 minutes."
"137","Solve for x and y: 1/x - 1/y = 1/3, 1/x2 + 1/y2 = 5/9.","x = 5/2 or -5 and y = 3 or -3/2.","x = 3/2 or -3 and y = 5 or -5/2.","x = 3/2 or -3 and y = 2 or -3/2.","x = 3/2 or -3 and y = 3 or -3/2.","x = 3/2 or -3 and y = 3 or -3/2."
"138","Daal is now being sold at Rs. 20 a kg. During last month its rate was Rs. 16 per kg. By how much percent should a family reduce its consumption so as to keep the expenditure fixed?","25 %.","20 %.","30 %.","40 %.","20 %."
"139","Can you find out what day of the week was January 12, 1979?","Friday.","Saturday.","Sunday.","Monday.","Friday."
"140","A garrison of 3300 men has provisions for 32 days, when given at a rate of 850 grams per head. At the end of 7 days a reinforcement arrives and it was found that now the provisions will last 8 days less, when given at the rate of 825 grams per head. How, many more men can it feed?","1500 men.","1700 men.","1900 men.","2100 men.","1700 men."
"141","From 5 different green balls, four different blue balls and three different red balls, how many combinations of balls can be chosen taking at least one green and one blue ball?","3720.","3920.","4320.","4520.","3720."
"142","Three pipes, A, B, & C are attached to a tank. A & B can fill it in 20 & 30 minutes respectively while C can empty it in 15 minutes. If A, B & C are kept open successively for 1 minute each, how soon will the tank be filled?","117 minutes.","139 minutes.","157 minutes.","167 minutes.","167 minutes."
"143","A person walking 5/6 of his usual rate is 40 minutes late. What is his usual time?","1 hours 20 minutes.","2 hours 40 minutes.","3 hours 20 minutes.","5 hours 20 minutes.","3 hours 20 minutes."
"144","A train covers a distance in 50 min ,if it runs at a speed
of 48kmph on an average.The speed at which the train must run
to reduce the time of journey to 40 min will be.","40kmph","60kmph","50kmph","45kmph","60kmph"
"145","The average ages of three persons is 27 years. Their ages are in the proportion of 1:3:5.What is the age in years of the youngest one among them.","45 years","27 years","9 years","3 years","9 years"
"146","The average of 11 numbers is 50. If the average of first 6 numbers is 49 and that of last 6 is 

52.Find the 6th number .","49","52","56","62","56"
"147","The smallest number which when divided by 20, 25, 35, 40 leaves the remainder 6 When divided 

by 14, 19, 23 and 34 respectively is the difference between divisor and The corresponding 

remainder is 6.","1494","1398","1394","1394","1394"
"148","Sum of three even consecutive numbers is 48, and then least number is.","20","18","16","14","14"
"149","Of the two-digit numbers (those from 11 to 95, both inclusive) how many have a Second digit 

greater than the first digit?","35","36","37","38","36"
"150","Vikas can cover a distance in 1hr 24min by covering 2/3 of
the distance at 4 kmph and the rest at 5kmph.the total
distance is ?","4km","6km","8km","12km","6km"
"151","Five years ago the average age of a family of 3 members was 27 years. A child has Been born, 

due to which the average age of the family is 25 years today. What is the Present age of the 

child ?","8 years","12 years","6 years","4 years","4 years"
"152","The greatest number of 4 digits which is divisible by each one of the number 12,18,21 and 28 

is .","9888","9288","9822","9828","9828"
"153","A boy was asked to find the value of 3/8 of a sum of money. Instead of multiplying The sum by 

3/8 he divided it by 3/8 and then his answer exceeded by Rs. 55. Find the Correct be x.
 	 ","Rs.9","Rs.18","Rs.15","Rs.7","Rs.9"
"154","In a boat 25 persons were sitting. Their average weight increased one kilogram when One man 

goes and a new man comes in. The weight of the new man is 70kgs. Find the Weight of the man 

who is going.","25 kgs","35 kgs","45 kgs","55 kgs","45 kgs"
"155","What is the greatest possible length that can be used to measure exactly the following Lengths 

7m, 3m 85cm, 12m 95cm ?","25 cm","35 cm","45 cm","55 cm","35 cm"
"156","A coffee shop blends 2 kinds of coffee,putting in 2 parts of a 33p. a gm. grade to 1 part of a 

24p. a gm.If the mixture is changed to 1 part of the 33p. a gm. to 2 parts of the less 

expensive grade,how much will the shop save in blending 100 gms.","Rs.8.00","Rs.3.00","Rs.1.00","Rs.0.90","Rs.3.00"
"157","There are 200 questions on a 3 hr examination. Among these questions are 50 Mathematics 

problems. It is suggested that twice as much time be spent on each maths problem as for each 

other question. How many minutes should be spent on Mathematics problems","36","72","60","100","72"
"158","If a and b are positive integers and (a-b)/3.5 = 4/7, then","b < a","b > a","b = a","b >= a","b < a"
"159","2 hours after a freight train leaves Delhi a passenger train leaves the same station traveling 

in the same direction at an average speed of 16 km/hr. After traveling 4 hrs the passenger 

train overtakes the freight train. The average speed of the freight train Was ?","30","40","58","60","40"
"160","If 9x-3y=12 and 3x-5y=7 then 6x-2y = ?","-5","4","2","8","8"
"161","If a boat is moving in upstream with velocity of 14 km/hr and goes downstream with a velocity 

of 40 km/hr, then what is the speed of the stream ?","13 km/hr","26 km/hr","34 km/hr","none of these","13 km/hr"
"162","Two trains move in the same direction at 50 kmph and 32 kmph respectively. A man in the slower 

train observes the 15 seconds elapse before the faster train completely passes by him. What is 

the length of faster train ?","100m","75m","120m","50m","75m"
"163","I drove 60 km at 30 kmph and then an additional 60 km at 50 kmph. Compute my average speed 

over my 120 km.
","40","37 1/2","25 1/2","50","37 1/2"
"164","Divide 45 into four parts such that when 2 is added to the first part, 2 is subtracted from 

the second part, 2 is multiplied by the third part and the fourth part is divided by two, all 

result in the same number.","8, 12, 5, 20","6,10,15,11","2,8,14,9","none of these","2,8,14,9"
