"165","What is the sum of the first 25 natural odd numbers?","225","125","525","625","625"
"166","Look at this series: 2, 1, (1/2), (1/4), ... What number should come next?","1/3","1/8","(2/8)","1/16","1/8"
"167","If Sam can do a job in 4 days that Lisa can do in 6 days and Tom can do in 2 days, how 

long would the job take if Sam, Lisa, and Tom worked together to complete it?","0.8 days","1.09 days","1.23 days","1.65 days","1.09 days"
"168","There are 8 ounces in a Â½ pound. How many ounces are in 7 3/4 lbs?","12 ounces","86 ounces","119 ounces","124 ounces","124 ounces"
"169","What is the next number in the following pattern? 1, 1/2, 1/4, 1/8, ___","1/10","1/12","1/14","1/16","1/16"
"170","If 6 is 24% of a number, what is 40% of the same number?","8","10","15","20","10"
"171","If 8x + 5x + 2x + 4x = 114, the 5x + 3 =","12","25","33","47","33"
"172","Find 8.23 x 109","0.00000000823","0.000000823","8.23","8230000000","8230000000"
"173","Divide x5 by x2","x25","x10","x7","x3","x3"
"174","The product of two consecutive even number is 4224. What is smaller number?","66","64","60","58","64"
"175","If the of 49a + 49b = 6272, what is the average of a and b?","64","74","84","62","64"
"176","Which is the number that comes next in the sequence 
         0, 6, 24, 60, 120, 210, ?","290","312","336","380","336"
"177","If in a certain language MYSTIFY is coded as NZTUJGZ,  how is NEMESIS 	coded in that language 

?","MDLHRDR","OFNFTJT","ODNHTDR","PGOKUGU","OFNFTJT"
"178","The average of nine consecutive odd numbers is 53. What is the smallest number ?","23","37","41","45","45"
"179","A and B can do a work in 5 days. A alone can do the same work in 8 days. In how many days will 

B do the same work?
","11(1/3)","12(2/5)","13(1/3)","15(4/5)","13(1/3)"
"180","5 year ago the average age of P,Q and R was 25 years and 7 years ago, the average age of Q and 

R was 20 years. What is P's present age ?","34 years","36 years","40 years","24 years","36 years"
"181","Pointing out of photograph, a man tells his friend, ""She is the daughter of the only son of my 

father's wife."" How is the girl in the photograph related the the man?","Daughter","Cousin","Mother","Sister","Daughter"
"182","A train crosses a pole in 15 seconds and a 100m. Long platform in 25 seconds. What is the 

length of the train ?","125m","130m","150m","175m","150m"
"183","The difference between compound interest and simple interest at 8% p.a. after 2 years is Rs. 

768. What is the sum?","100200","130000","120000","102000","120000"
"184","The cost of 2 chairs and 3 tables is Rs. 6050 and that of 3 chairs and 2 tables is Rs. 5450. 

What is the price of 1 table?","Rs. 1450","Rs. 1560","Rs. 1840","Rs. 1620","Rs. 1450"
"185","Anoop and Suyesh invested in the ratio of 4 : 7 respectively. If both invested Rs. 49500 

together, how much amount did Anoop invest?","Rs. 31500","Rs. 18000","Rs. 31000","Rs. 18500","Rs. 18000"
"186","What value will come in place of question mark (?) in the number series given below?
17, 24, 34, 47, 63, ?","80","81","82","83","82"
"187","Nikhil invests 26% of his annual income or Rs. 89856 in mutual fund . What is the monthly 

income ?","Rs. 24800","Rs. 23200","Rs. 28800","Rs. 26800","Rs. 28800"
"188","The difference between 87% and 71% of a number is 448. What is 59% of that number ?","1562","1652","1662","1552","1652"
"189","The area of circle is 154 cm2  . What is its circumference ?","44 cm","22 cm","11 cm","7 cm","44 cm"
"190","The  average age of a woman and her daughter is 21 years. The ratio of their ages is 5 : 1. 

What was the ratio of their ages 4 years ago","11 : 39","42 : 11","31 : 3","11 : 45","31 : 3"
"191","If an amount of Rs. 92070 is distributed amongst 135 persons. What is the amount that each 

person gets ?","Rs. 696","Rs. 658","Rs. 666","Rs. 682","Rs. 682"
"192","A canteen requires 45 kg rice for 3 days. How much kg of rice will it require for the months 

of June , July and August ?","1380 kg","1365 kg","1395 kg","1410 kg","1380 kg"
"193","Find the odd man out:
	74, 24, 82, 61, 10, 4","61","24","10","82","61"
"194","Find the odd man out:  15, 35, 45, 24 ,55, 65, 95","15","24","55","95","24"
"195","Find the odd man out:  1, 3, 7, 11, 15, 18, 21","3","7","18","21","18"
"196","Find the odd man out:
	4, 8, 12, 16, 20, 24, 27, 32","8","27","24","32","27"
"197","Find the odd man out:
	31, 37, 41, 45, 55, 58, 61, 67","31","41","67","58","58"
"198","The price of commodity X increases by 40 paise every year, while the price of commodity Y increases by 15 paise every year. If in 2001, the price of commodity X was Rs. 4.20 and that of Y was Rs. 6.30, in which year commodity X will cost 40 paise more than the commodity Y ?","2010","2011","2012","2013","2011"
"199","There are two examinations rooms A and B. If 10 students are sent from A to B, then the number of students in each room is the same. If 20 candidates are sent from B to A, then the number of students in A is double the number of students in B. The number of students in room A is:","20","80","100","200","100"
"200","If a - b = 3 and a2 + b2 = 29, find the value of ab.","10","12","15","18","10"
"1","Work done is said to be zero, when","some force acts on a body, but displacement is zero","no force acts on a body but some displacement takes place","either (a) or (b)","none of the above","either (a) or (b)"
"2","The point, through which the whole weight of the body acts, irrespective of its position, is known as","moment of inertia","centre of gravity","centre of percussion","centre of mass","centre of gravity

"
"3","The rate of change of momentum is directly proportional to the impressed force, and takes place in the same direction in which the force acts. This statement is known as","Newton's first law of motion","Newton's second law of motion","Newton's third law of motion","none of these","Newton's second law of motion"
"4","The mechanical advantage of a lifting machine is the ratio of","distance moved by effort to the distance moved by load","load lifted to the effort applied","output to the input","all of the above","load lifted to the effort applied"
"5","The friction experienced by a body, when in motion, is known as","rolling friction","dynamic friction","limiting friction","static friction","dynamic friction"
"6","Two balls of equal mass and of perfectly elastic material are lying on the floor. One of the ball with velocity v is made to struck the second ball. Both the balls after impact will move with a velocity","v","v/2","v/4","v/8","v/2"
"7","The bodies which rebound after impact are called","inelastic bodies","elastic bodies","neither elastic nor inelastic bodies","none of these","elastic bodies"
"8","Three forces acting on a rigid body are represented in magnitude, direction and line of action by the three sides of a triangle taken in order. The forces are equivalent to a couple whose moment is equal to","area of the triangle","twice the area of the triangle","half the area of the triangle","none of these","twice the area of the triangle"
"9","A body of mass m moving with a constant velocity v strikes another body of same mass m moving with same velocity but in opposite direction. The common velocity of both the bodies after collision is
","v","2v","4v","8v","2v"
"10","The unit of power in S.I. units is","horsepower","joule","watt","kg-m","kg-m"
"11","The value of bulk modulus of a fluid is required to determine","Reynold's number","Froude's number","Mach number","Euler's number","Mach number"
"12","In a depressed nappe","the pressure below the nappe is atmospheric","the pressure below the nappe is negative","the pressure above the nappe is atmospheric","the pressure above the nappe is negative","the pressure below the nappe is negative"
"13","In one dimensional flow, the flow","is steady and uniform","takes place in straight line","takes place in curve","takes place in one direction","takes place in straight line"
"14","Coefficient of contraction is the ratio of","actual velocity of jet at vena contracta to the theoretical velocity","loss of head in the orifice to the head of water available at the exit of the orifice","actual discharge through an orifice to the theoretical discharge","area of jet at vena contracta to the area of orifice","area of jet at vena contracta to the area of orifice"
"15","In a free nappe,","the pressure below the nappe is atmospheric","the pressure below the nappe is negative","the pressure above the nappe is atmospheric","the pressure above the nappe is negative","the pressure below the nappe is atmospheric"
"16","Coefficient of resistance is the ratio of","actual velocity of jet at vena contracta to the theoretical velocity","area of jet at vena contracta to the area of orifice","loss of head in the orifice to the head of water available at the exit of the orifice","actual discharge through an orifice to the dieoretical discharge","loss of head in the orifice to the head of water available at the exit of the orifice"
"17","In order to measure the flow with a venturimeter, it is installed in","horizontal line","inclined line with flow upwards","inclined line with flow downwards","any direction and in any location","any direction and in any location"
"18","Which of the following is an example of laminar flow?","Under ground flow","Flow past tiny bodies","Flow of oil in measuring instruments","all of these","all of these"
"19","The pressure less than atmospheric pressure is known as","suction pressure","vacuum pressure","negative gauge pressure","all of these","all of these"
"20","The total energy line lies over the hydraulic gradient line by an amount equal to the","pressure head","velocity head","pressure head + velocity head","pressure head - velocity head","velocity head"
"21","The coefficient of viscosity may be determined by","capillary tube method","orifice type viscometer","rotating cylinder method","all of these","all of these"
"22","The stability of a dam is checked for","tension at the base","overturning of the wall or dam","sliding of the wall or dam","all of these","all of these"
"23","A manometer is used to measure","low pressure","moderate pressure","high pressure","atomospheric pressure","high pressure"
"24","The centre of gravity of the volume of the liquid displaced is called","centre of pressure","centre of buoyancy","metacentre","none of these","centre of buoyancy"
"25","The coefficient of discharge for an external mouthpiece is","0.375","0.5","0.707","0.855","0.855"
"26","Strain energy is the","energy stored in a body when strained within elastic limits","energy stored in a body when strained upto the breaking of a specimen","maximum strain energy which can be stored in a body","proof resilience per unit volume of a material","energy stored in a body when strained within elastic limits"
"27","The neutral axis of the cross-section a beam is that axis at which the bending stress is","zero","minimum","maximum","infinity","zero"
"28","The object of caulking in a riveted joint is to make the joint","free from corrosion","stronger in tension","free from stresses","leak-proof","leak-proof"
"29","A steel bar of 5 mm is heated from 15° C to 40° C and it is free to expand. The bar Will induce","no stress","shear stress","tensile stress","compressive stress","no stress"
"30","A body is subjected to a tensile stress of 1200 MPa on one plane and another tensile stress of 600 MPa on a plane at right angles to the former. It is also subjected to a shear stress of 400 MPa on the same planes. The maximum normal stress will be","400 MPa","500 MPa","900 MPa","1400 MPa","1400 MPa"
"31","The stress induced in a body, when suddenly loaded, is __________ the stress induced when the same load is applied gradually.","equal to","one-half","twice","four times","twice"
"32","A masonry dam may fail due to","tension in the masonry of the dam and its base","overturning of the dam","crushing of masonry at the base of the dam","any one of the above","any one of the above"
"33","The maximum diameter of the hole that can be punched from a plate of maximum shear stress 1/4th of its maximum crushing stress of punch, is equal to (where t = Thickness of the plate)","t","2t","4t","8t","4t"
"34","The deformation per unit length is called","tensile stress","compressive stress","shear stress","strain","strain"
"35","Strain resetters are used to","measure shear strain","measure linear strain","measure volumetric strain","relieve strain","measure linear strain"
"36","For high speed engines, the cam follower should move with","uniform velocity","simple harmonic motion","uniform acceleration and retardation","cycloidal motion","cycloidal motion"
"37","In a coupling rod of a locomotive, each of the four pairs is a __________ pair.","sliding","turning","rolling","screw","turning"
"38","The factor which affects the critical speed of a shaft is","diameter of disc","span of shaft","eccentricity","all of these","all of these"
"39","The pair is known as a higher pair, when the relative motion between the elements of a pair is","turning only","sliding only","rolling only","partly turning and partly sliding","partly turning and partly sliding"
"40","The Whitworth quick return motion mechanism is formed in a slider crank chain when the","coupler link is fixed","longest link is a fixed link","slider is a fixed link","smallest link is a fixed link","coupler link is fixed"
"41","In railway axle boxes, the bearing used is","deep groove ball bearing","double row self-aligning ball bearing","double row spherical roller bearing","cylindrical roller bearing","double row spherical roller bearing"
"42","When the two elements of a pair have a surface contact when relative motion takes place and the surface of one element slides over the surface of the other, the pair formed is known as a","lower pair","higher pair","self-closed pair","force-closed pair","lower pair"
"43","The aim of value engineering is to","find the depreciation value of a machine","determine the selling price of a product","minimise the cost without change in quality of the product","minimise the cost without change in quality of the product","minimise the cost without change in quality of the product"
"44","In time study, the rating factor is applied to determine","standard time of a job","merit rating of the worker","fixation of incentive rate","normal time of a worker","fixation of incentive rate"
"45","Gantt chart is used for","inventory control","material handling","production schedule","machine repair schedules","production schedule"
"46","The main object of scientific layout is","to produce better quality of product","to utilise maximum floor area","to minimise production delays","all of these","all of these"
"47","In value engineering, the term value refers to","manufacturing cost of the product","selling price of the product","total cost of the product","utility of the product","utility of the product"
"48","In inventory control theory, the economic order quantity is","average level of inventory","optimum lot size","capacity of a warehouse","lot size corresponding to break-even analysis","optimum lot size"
"49","Production cost refers to prime cost plus","factory overheads","factory and administration overheads","factory, administration and sales overheads","factory, administration, sales overheads and profit","factory overheads"
"50","A systematic job improvement sequence will consist of","motion study","time study","job enrichment","all of these","all of these"
"51","Military type of organisation is known as","line organisation","functional organisation","line and staff organisation","line, staff and functional organisation","line organisation"
